data name,批注,文字等级,正文
D61,electromagnetic,note,"Electromagnetic mechanisms leverage the phenomenon that electrical currents produce electromagnetic fields applying force to magnets or moving electrical charges (Figure \ref{fig:am-sts-electromagnetic}). Freeman et al. adjusted coil attitude to generate specific magnetic fields for users holding a magnetic stylus to perceive tissue stiffness \cite{tong2017magnetic}. Magnetips \cite{mcintosh2019magnetips}deploys a coil generating electromagnetic pulse bursts on a mobile device and a magnet worn on a user's fingernail so that users feel around-device mid-air haptic feedback. PokeRing \cite{je2018pokering} and MagTics \cite{pece2017magtics} constructed mini magnetic solenoids comprising a coil and a moveable plunger to generate bidirectional linear movement. (Off-the-shelf electromagnetic actuators such as solenoids, DC motors, ERM, and LRA are not discussed here.)"
D62,piezoelectric,note,"Based on the inverse piezoelectric effect, piezoelectric materials deform when voltage is applied (Figure \ref{fig:am-sts-piezoelectric}). Piezoelectric actuators in different piezoelectric materials (rigid and soft) and structural configurations produce various haptic stimuli, e.g., high-frequency vibration and net force, as shown in the review articles by Mohith et al. \cite{mohith2020recent} and Gao et al. \cite{gao2020piezoelectric}. Rigid piezoelectric materials, such as crystals and ceramics, have larger piezoelectric constants, i.e., generate larger volume change subjected to an electric field, while flexible ones, such as polymers and polymer-inorganic composites, have smaller piezoelectric constants but are often favored due to their compliant and transparent properties. Since piezoelectric deformation is small (around 0.1\% over material dimension), researchers have proposed amplifying configurations, often called unimorph/bimorph bender, multilayer, structure-amplified, and stepper motor configuration. Multilayer actuators (Figure \ref{fig:am-sts-piezoelectric}A) can reduce operating voltages and combine responses from the different layers to achieve a broader range of motion, as used by LateralPaD \cite{ dai2012lateralpad}. Bending actuators (Figure \ref{fig:am-sts-piezoelectric}B) consist of piezoelectric layers in bimorph or unimorph configurations (e.g., PiezoHapt, TDK Electronics), where unsymmetric expansion between the two layers along the length direction induces significant bending deflection when subjected to an external electric field. Structure-amplified piezo actuators consist of an external structural amplifier, such as bridge mechanisms, which consist of piezoelectric ceramics sandwiched between two metal end caps (e.g.,  PowerHap™ 0904H014V060, TDK, image) (Figure \ref{fig:am-sts-piezoelectric}D), and flexure hinge mechanisms, which employ monolithic compliant structures (Figure \ref{fig:am-sts-piezoelectric}E)."
D63,phase transformation,note,"Based on thermoplastic stiffness-changing material, Carpenter et al. \cite{carpenter2019healable} introduced a form of kinesthetic glove that can switch between flexible or stiffened states. The glove is made from spandex impregnated with a thermoplastic polymer, so heating or cooling the textile just above or below its glass transition temperature dramatically changes its mechanical properties. Liquid crystal elastomers are based on an operating principle that involves rapid phase transitions between nematic and isotropic phases. Normally, liquid crystal elastomers (LCEs) contain rigid, anisotropic mesogenic units incorporated within polymer chains that remain mobile. When stimulated to the nematic phase, the mesogenic units become aligned in a direction without any crystalline orientation. The phase transformation can be created in response to thermal excitation, ultraviolet excitation, or electrical stimulation."
D64,shape memory,note,"Shape memory materials, including alloys, polymers, and composites, are capable of recovering a predetermined geometric shape (memorized) after a plastic deformation by inducing a phase transformation \cite{sreekumar2007critical}. At the base of this shape memory effect, there are different mechanical properties associated with different stable phases. Shape memory alloy (SMA) wires shaped into springs contract when electricity is applied to reach specific temperatures and expand when electricity is removed. They are widely adopted by HCI researchers since they are readily available online and require limited expertise. We identify three themes (Figure \ref{fig:am-sts-sma}). One is SMA springs attached on and reshaping the skin to deliver tactile sensations, like pinching, stretching, and shear force, as demonstrated by Springlets \cite{hamdan2019springlets}, Foo et al. \cite{foo2019iterative}, Besse et al. \cite{besse2017flexible}, and Muthukumarana et al. \cite{muthukumarana2020touch}. The other is using SMA springs to control end effectors. For example, Springlets use one SMA spring to move or transform objects on the skin surface. Hwang et al. \cite{hwang2017design} proposed a miniature haptic ring, where multiple SMA springs control a 3-DoF end effector to display touch/pressure and shearing force to a finger pad."
D65,rheological,note,"Electro- and magneto-rheological fluids or elastomers contain suspension of metal particles and change in viscosity when an external field is applied. There are essentially two types of rheological fluids that can be electrically modulated rheology or magnetically modulated. When subjected to an external magnetic or electric field, the particles orient and build chains in response to the inter-particle interaction. This translates into an increased resistance to deformation. Application schemes of MRF in HCI domain can be categorized into three groups (Figure \ref{fig:am-sts-rf}). The first is to let users touch MRF directly; for example, Rizzo et al. prove that MRF can simulate tissue properties \cite{rizzo2015displaying}. The second is to embed MRF between moving parts of  rigid actuators, such as a clutch \cite{najmaei2015design},  joystick \cite{chen2019development}, and linear actuator \cite{chen2019fw}, to control the motions. The last is to embed MRF into structures made from polymer for stiffness-changing mechanisms \cite{biswas2019emerging}. MRF-based  actuators can produce very strong forces but often require the driving material to be liquid, which can lead to cost and design constraints. In addition, these devices resist motion rather than produce motion."
D66,gel actuators,note,"Some gels generate mechanical changes (such as in volume and stiffness) when stimulated by pH, magnetic fields, light, or temperature. And once configured in some structures like multilayer, the mechanical changes can be further transferred \cite{miruchna2015geltouch}. A  wide  range of gels is available that can be stimulated in different manners that lend themselves to robust effects.  However, the gels must be maintained in a semiliquid form, which can make resulting devices mechanically sensitive. Additionally, the gel actuators typically result in relatively low bandwidths."
,,H2,Passive mechanisms
,,text,"Passive mechanisms utilize mechanical structures without external sources of power to present haptic profiles. Compared to the abovementioned mechanisms requiring power sources, passive mechanisms offer unchangeable force-displacement profiles but can be simpler, lighter, and less expensive. As a result, passive mechanisms are useful to applications that do not necessitate dynamic haptic profiles but favor lightweight, robust, and cost-effective features. Passive mechanisms can also serve as passive proxies in active mechanisms, as shown in section \ref{sec:proximate objects}. Passive mechanisms commonly leverage magnetic force, material flexibility, and structure flexibility, as described below."
D67,magnetic forces,note,"Researchers have shown many techniques using accessible magnetic materials to create various haptic sensations, such as embedding magnets to create tactile physical controls (e.g., buttons, sliders, switches, and dials) \cite{weiss2011fingerflux, zheng2018mechamagnets}, editing magnetic patterns on magnetic rubber sheets to build on-touchscreen haptic controls \cite{yasu2019magnetact}, using a mat made of magnets array and a handheld magnetic device to render bumpy surfaces \cite{yasu2015bump}, and layering multiple magnetic sheets with simple magnetic patterns to generate various tactile texture patterns \cite{yasu2020magnelayer, yasu2017magnetic}. Magneto-haptics\cite{ogata2018magneto} presented a computational estimation method of haptic texture generated by magnets distributions."
D68,flexible material,note,"Elastic materials can provide touch feelings with simpler mechanical structures than rigid ones. Some string-based VR controllers leveraged elastic strings to provide progressive resistance force for simulating compliant objects, such as ElasticVR \cite{tsai2019elasticvr}, Elastic-Arm \cite{achibet2015elastic}, FlexiFingers \cite{achibet2017flexifingers}, and DextrES \cite{hinchet2018dextres}. ElastOscillation \cite{tsai2020elastoscillation} presented a device that employs elastic bands modulated by a motor and connected to a mass. When shaking the device, users perceive damped oscillation, like swirling a glass of liquid. Bianchi et al. \cite{bianchi2016wearable} proposed modulating the stretch state of fabric through DC motors to exhibit different stiffness, which can simulate different textures."
D69,flexible structure,note,"Structural-flexibility-based mechanisms modulate mechanical properties by editing micro and macro structures of objects. They leverage metamaterial, origami and kirigami, and compliant structures. The structures add flexibility and movement allowance to a body of rigid material. Compared with material flexibility, structural flexibility can be fabricated without special material and is compatible with accessible fabrication methods, such as 3D printing and laser cutting. Metamaterial is based on microstructures with predictable elasticity by the beam diameter and beam density \cite{ion2019understanding,schumacher2015microstructures}. Embedding the tileable and parametric microstructures into 3D-printed or laser-cut objects allows objects to deform in specific ways in response to pressure. Kirigami Haptic Swatches \cite{chang2020kirigami} leverages kirigami and origami-based structures to render different sets of haptic feedback (i.e., linear, bistable, bouncing snap-through, and rotational force behaviors, respectively). Compliant mechanisms achieve force and motion transmission from, rather than rigid-body joints alone, elastic single-body deformation, which simplifies mechanical structures and allows digital fabrication \cite{le2019design, mazursky2020compact}. Ondulé \cite{he2019ondule} uses helical spring structures to create parameterizable deformation behaviors, including compress, extend, twist, and bend, in 3D-printable models."
,,H2,Others
,,,
,,H1,Simple mechanical changes to complex ones
,,text,"Researchers have developed methods to increase the range or DoF of small and simple mechanical changes. For instance, in piezoelectric actuators and electroactive polymer actuators, multilayer configurations are used to accumulate the force and displacement generated by single layers (and to reduce driving voltages). And for actuation mechanisms producing pulsed, precise, and small displacement, such as electromagnetic, electrostatic, and inverse piezoelectric mechanisms, stepping motor configurations are applied to generate controllable force, torque, and displacement in a rotary or linear track incrementally. This section introduces the mechanisms that have not been common enough to be integrated into predetermined actuators and are widely used by haptic interfaces with different actuation mechanisms (see Table \ref{tab:am-stc} in Appendix)."
D73,spatial distribution,note,"The spatial distribution of independently controllable simple actuators enables spatiotemporal animations of simple mechanical changes. The distribution patterns include arrays and organic distributions on a user’s body. In the arrays, the cells can be motor-driven pins used to render various 2.5D shapes in desktop-scale \cite{nakagaki2016materiable} and in handheld-scale \cite{ yoshida2020pocopo}. Array configurations are also widely combined with smart materials to form flexible, thin, and dense tactile displays, such as a $4\times4$ DEA array \cite{marette2017flexible}, $3\times9$ matrix of dielectric elastomer microactuators (DEMA) \cite{yun2019soft}, a $2\times2$ array of dielectric elastomer linear actuators \cite{zhao2020wearable}, a display made of spandex fabric electrostatically actuated by $3\times3$ array of electrodes \cite{sahoo2016tablehop},  and an $8\times6$ vibrotactile actuator array that uses a film of PVDF and pairs of electrodes \cite{choi2019transparent}. Other than regular arrays,  researchers distributed actuators along the human body more organically, like a line of solenoids around a finger \cite{je2018pokering}, wrist \cite{pece2017magtics}, and eye \cite{tseng2020skin}, a solenoids distribution on hand \cite{ vechev2019tactiles}, SMA on-body stickers to render pressure, skin-stretch, and vibration effects \cite{muthukumarana2020touch}, airbags across an arm \cite{zhu2020pneusleeve} and torso \cite{delazio2018force} to provide haptic feelings such as punch, hug, and snake moving."
D74,mechanical mechanisms multiple 1DOF to single multiDOF,note,"Many haptic interfaces, such as those applying directional force-feedback and skin-stretch \cite{pacchierotti2017wearable}, require one end effector with multiple DoFs. Thus researchers proposed mechanisms that take in multiple simple actuation and output one controllable multi-DoF actuation. For example, delta mechanisms  \cite{schorr2017fingertip} and three Revolute-Revolute-Spherical mechanisms (3RRS) \cite{chinello2017three} use three rotary actuators driving the three legs of an end effector with 3DoF. Traditionally, such mechanisms are driven by electromechanical motors and made from multiple rigid parts and pins and hinges. Recently, researchers have adopted new source-to-simple actuations, such as piezoelectric stacks \cite{ pinskier2018development}, piezoelectric benders \cite{mcclintock2018millidelta, mintchev2019portable}, and SMA wires \cite{abuzaiter2015development}, and leveraged new mechanical structures, such as compliant structures \cite{ pinskier2018development} and origami structures \cite{mcclintock2018millidelta, mintchev2019portable, kalafat2021novel}. The adoption introduces the advantages of the new source-to-simple actuating mechanisms and mechanical structures to the resulting mechanisms, such as high bandwidth and high precision brought by piezoelectric actuators and simplified structure and fabrication enabled by compliant and origami structures."
D75,string based,note,"String/rod-based mechanisms modulated the length or tension of strings/rods connecting a grounding point and an stimulating point, e.g., the shoulder and finger, with unidirectional braking or retracting mechanism to provide haptic sensations.  It takes in simple mechanical changes, such as magnitude changes in braking forces, and generates complex sensations, such as force feedbacks correlated with fingers and hand positions in a 3D space. String/rod-based mechanisms vary by machine configurations and connected s. In Grabity \cite{choi2017grabity}, the mechanism was mounted between the thumb and index finger and utilized a gliding-through rod and a brake to create rigid grasping force feedback. Wolverine \cite{choi2016wolverine}, also employing rods and brakes, was worn on the thumb and three fingers to simulate objects held in pad opposition type grasps. In DextrES \cite{hinchet2018dextres}, the mechanisms consist of two overlapped metal strips with a dielectric layer in between, and provide sliding resistance when voltage is on. The flexible mechanisms are worn between the fingertips and the waist to render on-demand kinesthetic feedback. Wireality consists of retractable string reels with a solenoid to lock the string. The reels are mounted on the shoulder, and the other ends of the strings are linked to hand joints to arrest individual joints in 3D space \cite{fang2020wireality}."
D76,pneumatic & hydraulic mechanisms,note,"Fluidic mechanisms consisting of working fluids (e.g., air, water, or oil) and chambers convert the simple output of pumps to simulate pressures, shape changes, or motions, and are soft and monolithic alternatives to rigid multi-part mechanisms. Air chambers were employed to build buttons, knobs, and sliders with programmable activation forces \cite{vazquez20153d}. Chambers were widely used in wearable haptic devices, as the mechanical compliance of chambers is compatible with human bodies. For example, airbags were deployed to arm \cite{zhu2020pneusleeve} and torso  \cite{delazio2018force} to render haptic sensations such as punch, hug, and snake moving across the body. HydroRing \cite{han2018hydroring}presented a finger-worn device using liquid traveling through a thin, flexible latex tube worn across a finger pad to simulate tactile sensations of pressure, vibration, and temperature. HapBead \cite{han2020hapbead} leveraged a microfluidic channel to oscillate a small bead in the channel to create vibration-like tactile feedback on the skin. Inflatable airbags are compact when deactivated and inflate into different geometries when in play, thus were used as on-demand proximate objects in devices worn on palms \cite{hu2019pneu, teng2018pupop} in room-scale shape-changing interfaces \cite{suzuki2020lifttiles}."
